{
  "$schema": "https://json-schema.org/draft/2020-12/schema",
  "$id": "https://squad.dev/spec/squad-conformance/v0.1/index.schema.json",
  "title": "Squad Conformance Suite Index v0.1",
  "type": "object",
  "additionalProperties": false,
  "required": ["suite", "schemaVersion", "publication", "dialects", "sharedSchemas", "profiles"],
  "properties": {
    "$schema": { "type": "string", "minLength": 1 },
    "suite": { "const": "squad-conformance/v0.1" },
    "schemaVersion": { "const": 1 },
    "publication": {
      "type": "object",
      "additionalProperties": false,
      "required": ["status", "revision", "digest"],
      "properties": {
        "status": { "enum": ["working-draft", "published"] },
        "revision": {
          "anyOf": [
            { "type": "string", "pattern": "^[a-f0-9]{40}$" },
            { "type": "null" }
          ]
        },
        "digest": {
          "anyOf": [
            { "type": "string", "pattern": "^sha256:[a-f0-9]{64}$" },
            { "type": "null" }
          ]
        }
      },
      "allOf": [
        {
          "if": { "properties": { "status": { "const": "published" } } },
          "then": {
            "properties": {
              "revision": { "type": "string" },
              "digest": { "type": "string" }
            }
          }
        }
      ]
    },
    "dialects": {
      "type": "array",
      "minItems": 1,
      "items": { "$ref": "#/$defs/dialect" }
    },
    "sharedSchemas": {
      "type": "array",
      "items": { "$ref": "#/$defs/repoPath" },
      "uniqueItems": true
    },
    "profiles": {
      "type": "array",
      "minItems": 1,
      "items": { "$ref": "#/$defs/profile" }
    }
  },
  "$defs": {
    "repoPath": {
      "type": "string",
      "minLength": 1,
      "not": { "pattern": "(^/|(^|/)\\.\\.(/|$)|\\\\)" }
    },
    "profileId": {
      "type": "string",
      "pattern": "^squad-[a-z0-9-]+/v(?:0|[1-9][0-9]*)\\.(?:0|[1-9][0-9]*)$"
    },
    "capability": {
      "type": "string",
      "pattern": "^squad-[a-z0-9-]+/v(?:0|[1-9][0-9]*)\\.(?:0|[1-9][0-9]*)/[a-z0-9-]+$"
    },
    "digest": {
      "type": "string",
      "pattern": "^sha256:[a-f0-9]{64}$"
    },
    "revision": {
      "type": "object",
      "additionalProperties": false,
      "required": ["specification", "evidence"],
      "properties": {
        "specification": {
          "type": "object",
          "additionalProperties": false,
          "required": ["artifact", "algorithm", "digest"],
          "properties": {
            "artifact": { "$ref": "#/$defs/repoPath" },
            "algorithm": { "const": "sha256" },
            "digest": { "$ref": "#/$defs/digest" }
          }
        },
        "evidence": {
          "type": "object",
          "additionalProperties": false,
          "required": ["artifact", "algorithm", "canonicalization", "scope", "digest"],
          "properties": {
            "artifact": { "$ref": "#/$defs/repoPath" },
            "algorithm": { "const": "sha256" },
            "canonicalization": { "const": "rfc8785" },
            "scope": { "const": "manifest-excluding-revision" },
            "digest": { "$ref": "#/$defs/digest" }
          }
        }
      }
    },
    "dialect": {
      "type": "object",
      "additionalProperties": false,
      "required": ["id", "description"],
      "properties": {
        "id": { "type": "string", "pattern": "^[a-z0-9]+(?:-[a-z0-9]+)*$" },
        "description": { "type": "string", "minLength": 1 }
      }
    },
    "profile": {
      "type": "object",
      "additionalProperties": false,
      "required": [
        "id",
        "maturity",
        "documentClass",
        "spec",
        "revision",
        "dialect",
        "dependencies",
        "conformanceClasses",
        "implementationRoles",
        "capabilities",
        "manifest",
        "manifestSchema",
        "fixtures",
        "implementationStatus",
        "knownDeviations",
        "promotionCriteria",
        "entryPoint"
      ],
      "properties": {
        "id": { "$ref": "#/$defs/profileId" },
        "maturity": {
          "enum": [
            "executable-normative-draft",
            "experimental-normative-draft",
            "experimental-schema",
            "requirements-draft",
            "informative-draft"
          ]
        },
        "documentClass": {
          "enum": [
            "normative-profile",
            "normative-schema",
            "requirements",
            "informative"
          ]
        },
        "spec": { "$ref": "#/$defs/repoPath" },
        "revision": {
          "anyOf": [
            { "$ref": "#/$defs/revision" },
            { "type": "null" }
          ]
        },
        "dialect": { "type": "string", "minLength": 1 },
        "dependencies": {
          "type": "array",
          "items": { "$ref": "#/$defs/profileId" },
          "uniqueItems": true
        },
        "conformanceClasses": {
          "type": "array",
          "items": {
            "enum": [
              "canonical",
              "compatible",
              "legacy",
              "runtime"
            ]
          },
          "uniqueItems": true
        },
        "implementationRoles": {
          "type": "array",
          "items": {
            "enum": [
              "producer",
              "consumer",
              "editor",
              "validator",
              "executor"
            ]
          },
          "uniqueItems": true
        },
        "capabilities": {
          "type": "array",
          "items": { "$ref": "#/$defs/capability" },
          "uniqueItems": true
        },
        "manifest": {
          "anyOf": [
            { "$ref": "#/$defs/repoPath" },
            { "type": "null" }
          ]
        },
        "manifestSchema": {
          "anyOf": [
            { "$ref": "#/$defs/repoPath" },
            { "type": "null" }
          ]
        },
        "fixtures": {
          "type": "array",
          "items": { "$ref": "#/$defs/repoPath" },
          "uniqueItems": true
        },
        "implementationStatus": { "type": "string", "minLength": 1 },
        "knownDeviations": {
          "type": "array",
          "items": { "type": "string", "minLength": 1 },
          "uniqueItems": true
        },
        "promotionCriteria": {
          "type": "array",
          "items": { "type": "string", "minLength": 1 },
          "uniqueItems": true
        },
        "entryPoint": { "type": "string", "minLength": 1 }
      },
      "allOf": [
        {
          "if": {
            "properties": {
              "manifest": { "type": "null" }
            },
            "required": ["manifest"]
          },
          "then": {
            "properties": {
              "revision": { "type": "null" },
              "capabilities": { "type": "array", "maxItems": 0 },
              "conformanceClasses": { "type": "array", "maxItems": 0 }
            }
          },
          "else": {
            "properties": {
              "revision": { "$ref": "#/$defs/revision" }
            }
          }
        },
        {
          "if": {
            "properties": {
              "maturity": {
                "enum": ["requirements-draft", "informative-draft"]
              }
            },
            "required": ["maturity"]
          },
          "then": {
            "properties": {
              "documentClass": {
                "enum": ["requirements", "informative"]
              },
              "capabilities": { "type": "array", "maxItems": 0 },
              "conformanceClasses": { "type": "array", "maxItems": 0 }
            }
          }
        }
      ]
    }
  }
}
