{
  "$schema": "./index.schema.json",
  "suite": "squad-conformance/v0.1",
  "schemaVersion": 1,
  "publication": {
    "status": "working-draft",
    "revision": null,
    "digest": null
  },
  "dialects": [
    {
      "id": "charter-v0-1",
      "description": "Executable Charter v0.1 working-draft conformance manifest."
    },
    {
      "id": "normative-draft",
      "description": "Normative working draft without standalone claimable capabilities."
    },
    {
      "id": "suite-v0-1",
      "description": "Reference shared schemas and fixtures with no conformance claim."
    },
    {
      "id": "requirements-only",
      "description": "Non-claimable conceptual coverage with explicit promotion criteria."
    }
  ],
  "sharedSchemas": [
    "test-fixtures/spec/suite-v0.1/evidence.schema.json"
  ],
  "profiles": [
    {
      "id": "squad-core/v0.1",
      "maturity": "experimental-normative-draft",
      "documentClass": "normative-profile",
      "spec": "docs/specification/core-v0.1.md",
      "revision": null,
      "dialect": "normative-draft",
      "dependencies": [],
      "conformanceClasses": [],
      "implementationRoles": ["producer", "consumer", "editor", "validator", "executor"],
      "capabilities": [],
      "manifest": null,
      "manifestSchema": null,
      "fixtures": [],
      "implementationStatus": "Shared terminology is used by Charter v0.1; no standalone Core manifest exists.",
      "knownDeviations": ["Publication and canonical JSON rules remain incomplete."],
      "promotionCriteria": ["Publish a standalone manifest covering paths, versions, diagnostics, and trust rules."],
      "entryPoint": "Core terminology, then Charter v0.1 for executable behavior."
    },
    {
      "id": "squad-interop/v0.1",
      "maturity": "requirements-draft",
      "documentClass": "requirements",
      "spec": "docs/specification/interoperability-conventions-v0.1.md",
      "revision": null,
      "dialect": "requirements-only",
      "dependencies": ["squad-core/v0.1"],
      "conformanceClasses": [],
      "implementationRoles": ["producer", "consumer", "validator", "executor"],
      "capabilities": [],
      "manifest": null,
      "manifestSchema": null,
      "fixtures": [],
      "implementationStatus": "A shared evidence schema and reference checks exist, but no portable interoperability manifest is registered.",
      "knownDeviations": ["No discovery manifest, relational-invariant catalog, or cross-implementation evidence corpus exists."],
      "promotionCriteria": ["Add portable manifests with neutral observation, authority, replay, CAS, privacy, and relational-invariant cases."],
      "entryPoint": "Use as requirements and reference shapes after Core."
    },
    {
      "id": "squad-charter/v0.1",
      "maturity": "executable-normative-draft",
      "documentClass": "normative-profile",
      "spec": "docs/specification/charter-v0.1.md",
      "revision": {
        "specification": {
          "artifact": "docs/specification/charter-v0.1.md",
          "algorithm": "sha256",
          "digest": "sha256:9bdc6440b83fbd087d7ac01129146dda067d86501b7d3ecf2e81134d5b7ce7c2"
        },
        "evidence": {
          "artifact": "test-fixtures/spec/charter-v0.1/manifest.json",
          "algorithm": "sha256",
          "canonicalization": "rfc8785",
          "scope": "manifest-excluding-revision",
          "digest": "sha256:1f09c1954e056ea2072e3c79e286869790ae69751cba0ca4cfd58fd2fa0a92bb"
        }
      },
      "dialect": "charter-v0-1",
      "dependencies": ["squad-core/v0.1"],
      "conformanceClasses": ["canonical", "compatible", "legacy", "runtime"],
      "implementationRoles": ["producer", "consumer", "editor", "validator", "executor"],
      "capabilities": [
        "squad-charter/v0.1/parse",
        "squad-charter/v0.1/validate",
        "squad-charter/v0.1/edit",
        "squad-charter/v0.1/legacy-consume",
        "squad-charter/v0.1/runtime"
      ],
      "manifest": "test-fixtures/spec/charter-v0.1/manifest.json",
      "manifestSchema": "test-fixtures/spec/charter-v0.1/manifest.schema.json",
      "fixtures": [],
      "implementationStatus": "Reference parser, validator, editor, runtime compiler, and portable cases are implemented.",
      "knownDeviations": [],
      "promotionCriteria": [],
      "entryPoint": "Start here for executable artifact conformance."
    },
    {
      "id": "squad-team-routing/v0.1",
      "maturity": "requirements-draft",
      "documentClass": "requirements",
      "spec": "docs/specification/team-routing-v0.1.md",
      "revision": null,
      "dialect": "requirements-only",
      "dependencies": ["squad-core/v0.1", "squad-interop/v0.1", "squad-charter/v0.1"],
      "conformanceClasses": [],
      "implementationRoles": ["producer", "consumer", "editor", "validator", "executor"],
      "capabilities": [],
      "manifest": null,
      "manifestSchema": null,
      "fixtures": [],
      "implementationStatus": "Roster and routing are implemented in multiple shapes but have no portable manifest.",
      "knownDeviations": ["Routing fallback and ambiguity policies are not represented uniformly."],
      "promotionCriteria": ["Add separate roster and routing cases, joins, diagnostics, stale-write, and resolution evidence."],
      "entryPoint": "Read roster requirements before routing requirements."
    },
    {
      "id": "squad-configuration-casting/v0.1",
      "maturity": "requirements-draft",
      "documentClass": "requirements",
      "spec": "docs/specification/configuration-casting-v0.1.md",
      "revision": null,
      "dialect": "requirements-only",
      "dependencies": ["squad-core/v0.1", "squad-interop/v0.1", "squad-team-routing/v0.1"],
      "conformanceClasses": [],
      "implementationRoles": ["producer", "consumer", "editor", "validator", "executor"],
      "capabilities": [],
      "manifest": null,
      "manifestSchema": null,
      "fixtures": [],
      "implementationStatus": "Configuration, casting registry, and provenance exist but are not one portable profile.",
      "knownDeviations": ["Legacy registry shapes and runtime-only configuration keys remain accepted."],
      "promotionCriteria": ["Add independent configuration, casting, and provenance manifests with migration and CAS cases."],
      "entryPoint": "Read configuration, casting identity, then provenance sections independently."
    },
    {
      "id": "squad-governance-review/v0.1",
      "maturity": "requirements-draft",
      "documentClass": "requirements",
      "spec": "docs/specification/governance-review-v0.1.md",
      "revision": null,
      "dialect": "requirements-only",
      "dependencies": ["squad-core/v0.1", "squad-interop/v0.1", "squad-team-routing/v0.1"],
      "conformanceClasses": [],
      "implementationRoles": ["producer", "consumer", "validator", "executor"],
      "capabilities": [],
      "manifest": null,
      "manifestSchema": null,
      "fixtures": [
        "test-fixtures/spec/suite-v0.1/governance-rejection.example.json"
      ],
      "implementationStatus": "A reference evidence schema, rejection fixture, and TypeScript checks exist; they establish no portable governance claim.",
      "knownDeviations": ["Relational invariants are implemented only as TypeScript reference checks, and repository governance previously permitted immediate owner self-revision."],
      "promotionCriteria": ["Define language-neutral relational invariants and add a transition manifest covering approval, reviewer independence, lockout, successor eligibility, replay links, CAS, blockers, escalation, and deadlock."],
      "entryPoint": "Use as non-claimable requirements and reference shapes."
    },
    {
      "id": "squad-execution-preferences/v0.1",
      "maturity": "requirements-draft",
      "documentClass": "requirements",
      "spec": "docs/specification/execution-preferences-v0.1.md",
      "revision": null,
      "dialect": "requirements-only",
      "dependencies": ["squad-core/v0.1", "squad-interop/v0.1", "squad-charter/v0.1", "squad-configuration-casting/v0.1"],
      "conformanceClasses": [],
      "implementationRoles": ["consumer", "validator", "executor"],
      "capabilities": [],
      "manifest": null,
      "manifestSchema": null,
      "fixtures": [],
      "implementationStatus": "Selection and fallback exist in the reference runtime only.",
      "knownDeviations": ["Provider model names and fallback chains are implementation policy."],
      "promotionCriteria": ["Add preference-resolution cases with policy, authorization, availability, and loss reporting."],
      "entryPoint": "Use for portable intent design, not a current conformance claim."
    },
    {
      "id": "squad-work-lifecycle/v0.1",
      "maturity": "requirements-draft",
      "documentClass": "requirements",
      "spec": "docs/specification/work-lifecycle-v0.1.md",
      "revision": null,
      "dialect": "requirements-only",
      "dependencies": ["squad-core/v0.1", "squad-interop/v0.1", "squad-team-routing/v0.1", "squad-governance-review/v0.1"],
      "conformanceClasses": [],
      "implementationRoles": ["producer", "consumer", "validator", "executor"],
      "capabilities": [],
      "manifest": null,
      "manifestSchema": null,
      "fixtures": [],
      "implementationStatus": "The state vocabulary is a provider-neutral design; no executable transition corpus exists.",
      "knownDeviations": ["Current providers do not expose one shared revision or recovery model."],
      "promotionCriteria": ["Add complete positive and negative transition traces against GitHub and one non-GitHub provider."],
      "entryPoint": "Read before any provider binding."
    },
    {
      "id": "squad-work-github/v0.1",
      "maturity": "requirements-draft",
      "documentClass": "requirements",
      "spec": "docs/specification/github-work-lifecycle-binding-v0.1.md",
      "revision": null,
      "dialect": "requirements-only",